{
  "algorithm_version": "0.1.0",
  "audit_run_id": "db9d181e-237d-40b8-b725-555ee30fffb9",
  "backend": "plaintext",
  "deployment_id": "vec-deploy",
  "depth_budget": {
    "consumed": 6,
    "declared": 6
  },
  "input_commitments": [],
  "issued_at": "2026-10-28T08:57:22.340209+00:00",
  "issuer": "vector-issuer-010",
  "key_id": "vec010-key-1",
  "parameter_set": {
    "backend": "plaintext",
    "backend_version": "",
    "coeff_mod_bit_sizes": [],
    "library_version": "0.1.0",
    "multiplicative_depth": 6,
    "poly_modulus_degree": 0,
    "scaling_factor_bits": 0,
    "security_bits": 128
  },
  "parameter_set_hash": "c1262015326d48cee3ffb27e5083cb8da9587247afc81c48848d91b23722776d",
  "primitive": "calibration",
  "public_key_fingerprint": "eda84490df34242a6c30bf3a41480a6358906b91a5db2317415a294aae00e99b",
  "receipt": {
    "public_key_pem": "-----BEGIN PUBLIC KEY-----\nMCowBQYDK2VwAyEAwYndnnrv3XSzOJrh+uxhHPeG9lUFz/tqJ3VcveREaIY=\n-----END PUBLIC KEY-----\n",
    "sha256": "fb47bf66640274e31bdb10795c4a3ee22905df0a41f4e90edfdb4b49d1f986f6",
    "signature_alg": "Ed25519",
    "signature_b64": "H9n8x3gbf+e42mYqeaTkmlTW+79vTj26n/CgBAFMQJTr29Spx6/QMDGqCqpdC2fYYSJEQHgNXcv9OcA0LEMIDw=="
  },
  "regulations": [
    "FDA_SAMD_UQ",
    "EU_AI_ACT_ART15",
    "ISO_IEC_23053",
    "UNECE_WP29"
  ],
  "result": {
    "membership": [
      1.0,
      1.0,
      1.0
    ],
    "set_size": 3
  },
  "schema": "regaudit-fhe.report.v2",
  "schema_version": "regaudit-fhe.report.v2",
  "trust_policy_version": 1
}
