{
  "algorithm_version": "0.1.0",
  "audience": [
    "verifier-a"
  ],
  "audit_run_id": "b2b985b3-0015-4b80-a56f-5422754e8184",
  "backend": "plaintext",
  "dataset_commitment": {
    "name": "data",
    "sha256": "1111111111111111111111111111111111111111111111111111111111111111"
  },
  "deployment_id": "vec-deploy",
  "depth_budget": {
    "consumed": 6,
    "declared": 6
  },
  "dp": {
    "applied": true,
    "fields": {
      "w1_distance": {
        "epsilon": 1.0,
        "mechanism": "laplace",
        "noise_scale": 0.1,
        "sensitivity": 0.1
      }
    }
  },
  "input_commitments": [
    {
      "name": "p",
      "sha256": "cbc5c4264f2784d99589328bb6b25f1ee4e83283634f6d0ec595d28c29f36159"
    }
  ],
  "issued_at": "2026-10-28T08:57:22.341039+00:00",
  "issuer": "vector-issuer-010",
  "key_id": "vec010-key-1",
  "model_commitment": {
    "name": "model",
    "sha256": "0000000000000000000000000000000000000000000000000000000000000000"
  },
  "parameter_set": {
    "backend": "plaintext",
    "backend_version": "",
    "coeff_mod_bit_sizes": [],
    "library_version": "0.1.0",
    "multiplicative_depth": 6,
    "poly_modulus_degree": 0,
    "scaling_factor_bits": 0,
    "security_bits": 128
  },
  "parameter_set_hash": "c1262015326d48cee3ffb27e5083cb8da9587247afc81c48848d91b23722776d",
  "primitive": "drift",
  "public_key_fingerprint": "eda84490df34242a6c30bf3a41480a6358906b91a5db2317415a294aae00e99b",
  "receipt": {
    "public_key_pem": "-----BEGIN PUBLIC KEY-----\nMCowBQYDK2VwAyEAwYndnnrv3XSzOJrh+uxhHPeG9lUFz/tqJ3VcveREaIY=\n-----END PUBLIC KEY-----\n",
    "sha256": "ed5eb18215b874f373eb0a8ac95a0e9431b8022cb2cd003d91ba04595589a69d",
    "signature_alg": "Ed25519",
    "signature_b64": "FahkL3C4XfcEo3czQ4OVbkwbAYagDQa8jPHmRysIKcNzNXi+ysVymLLubeDS5SItBciCFEqidFLwTER7vEqlBQ=="
  },
  "regulations": [
    "EU_AI_ACT_ART15",
    "FDA_SAMD_PCCP",
    "BASEL_III"
  ],
  "result": {
    "distance": 0.0024999999999999988,
    "drift_bit": false,
    "w1_distance": 0.04999999999999999
  },
  "schema": "regaudit-fhe.report.v2",
  "schema_version": "regaudit-fhe.report.v2",
  "trust_policy_version": 1
}
