{
  "algorithm_version": "0.1.0",
  "audit_run_id": "42fe4d35-7336-43cf-9c42-c2166708ad8b",
  "backend": "plaintext",
  "deployment_id": "vec-deploy",
  "depth_budget": {
    "consumed": 6,
    "declared": 6
  },
  "input_commitments": [],
  "issued_at": "2026-10-28T08:57:22.339927+00:00",
  "issuer": "vector-issuer-010",
  "key_id": "vec010-key-1",
  "parameter_set": {
    "backend": "plaintext",
    "backend_version": "",
    "coeff_mod_bit_sizes": [],
    "library_version": "0.1.0",
    "multiplicative_depth": 6,
    "poly_modulus_degree": 0,
    "scaling_factor_bits": 0,
    "security_bits": 128
  },
  "parameter_set_hash": "c1262015326d48cee3ffb27e5083cb8da9587247afc81c48848d91b23722776d",
  "primitive": "concordance",
  "public_key_fingerprint": "eda84490df34242a6c30bf3a41480a6358906b91a5db2317415a294aae00e99b",
  "receipt": {
    "public_key_pem": "-----BEGIN PUBLIC KEY-----\nMCowBQYDK2VwAyEAwYndnnrv3XSzOJrh+uxhHPeG9lUFz/tqJ3VcveREaIY=\n-----END PUBLIC KEY-----\n",
    "sha256": "7aa2d2c2c2e4157df1b3b0a9b48c369b08520cdfd1f17696f173607b72895b5e",
    "signature_alg": "Ed25519",
    "signature_b64": "+dnaELU/Rv6WGM0esL2flrQqxKyzPLgetNR0BEwvq1ySr2+TLtB26cBOwZba/2VT00e+V+EPU9nEFU9Fx3N8CQ=="
  },
  "regulations": [
    "FDA_SAMD_PCCP",
    "EU_AI_ACT_ART15",
    "EMA_AI_GUIDANCE"
  ],
  "result": {
    "c_index": 0.8125720580439968,
    "comparable_pairs": 4.074074074074074,
    "concordant_pairs": 3.3104787549940613
  },
  "schema": "regaudit-fhe.report.v2",
  "schema_version": "regaudit-fhe.report.v2",
  "trust_policy_version": 1
}
