{
  "algorithm_version": "0.1.0",
  "audit_run_id": "87d32080-cbad-4bc7-a8c6-62a3626b8ef8",
  "backend": "plaintext",
  "deployment_id": "vec-deploy",
  "depth_budget": {
    "consumed": 6,
    "declared": 6
  },
  "input_commitments": [],
  "issued_at": "2026-10-28T08:57:22.340753+00:00",
  "issuer": "vector-issuer-010",
  "key_id": "vec010-key-1",
  "parameter_set": {
    "backend": "plaintext",
    "backend_version": "",
    "coeff_mod_bit_sizes": [],
    "library_version": "0.1.0",
    "multiplicative_depth": 6,
    "poly_modulus_degree": 0,
    "scaling_factor_bits": 0,
    "security_bits": 128
  },
  "parameter_set_hash": "c1262015326d48cee3ffb27e5083cb8da9587247afc81c48848d91b23722776d",
  "primitive": "disagreement",
  "public_key_fingerprint": "eda84490df34242a6c30bf3a41480a6358906b91a5db2317415a294aae00e99b",
  "receipt": {
    "public_key_pem": "-----BEGIN PUBLIC KEY-----\nMCowBQYDK2VwAyEAwYndnnrv3XSzOJrh+uxhHPeG9lUFz/tqJ3VcveREaIY=\n-----END PUBLIC KEY-----\n",
    "sha256": "07911dd3453a54d43ad70909648b65c06616b96ec73aeeba36c0624480d5a169",
    "signature_alg": "Ed25519",
    "signature_b64": "rIUwBGhEz17KRV1rBiap6VM5gesQsgsqNie84S9W2aqIq7e1UHZEW2rUxs8+Ah6+E4VYBkEOSrnvbAfqvyftAA=="
  },
  "regulations": [
    "OCC_SR_11_7",
    "EU_AI_ACT_ART15",
    "FDA_SAMD_PCCP"
  ],
  "result": {
    "breach": false,
    "pairwise_variance": 0.0007451522222222225,
    "per_model_outputs": [
      0.20000000000000004,
      0.18466666666666667,
      0.22060000000000002
    ]
  },
  "schema": "regaudit-fhe.report.v2",
  "schema_version": "regaudit-fhe.report.v2",
  "trust_policy_version": 1
}
