{
  "algorithm_version": "0.1.0",
  "audit_run_id": "8e7e85a6-42a3-4fe3-8d46-576df0ce5017",
  "backend": "plaintext",
  "deployment_id": "vec-deploy",
  "depth_budget": {
    "consumed": 6,
    "declared": 6
  },
  "input_commitments": [],
  "issued_at": "2026-10-28T08:57:22.338280+00:00",
  "issuer": "vector-issuer-010",
  "key_id": "vec010-key-1",
  "parameter_set": {
    "backend": "plaintext",
    "backend_version": "",
    "coeff_mod_bit_sizes": [],
    "library_version": "0.1.0",
    "multiplicative_depth": 6,
    "poly_modulus_degree": 0,
    "scaling_factor_bits": 0,
    "security_bits": 128
  },
  "parameter_set_hash": "c1262015326d48cee3ffb27e5083cb8da9587247afc81c48848d91b23722776d",
  "primitive": "fairness",
  "public_key_fingerprint": "eda84490df34242a6c30bf3a41480a6358906b91a5db2317415a294aae00e99b",
  "receipt": {
    "public_key_pem": "-----BEGIN PUBLIC KEY-----\nMCowBQYDK2VwAyEAwYndnnrv3XSzOJrh+uxhHPeG9lUFz/tqJ3VcveREaIY=\n-----END PUBLIC KEY-----\n",
    "sha256": "aeae7d055ca950147ae3ab32abb2fcfe3beae9138986927aac2bc1402e5c5c3c",
    "signature_alg": "Ed25519",
    "signature_b64": "HUW2WIZ1DysFc//aO9Qh+JlkYF38B1tdQCVds+Q0UOnydRu8/hyNJ9teHZ2h3lN1IuCWzII081LU06r50MTwBQ=="
  },
  "regulations": [
    "NYC_LL144",
    "EU_AI_ACT_ART10",
    "EU_AI_ACT_ART15",
    "COLORADO_AI_ACT",
    "CFPB_ALG_DISCRIM"
  ],
  "result": {
    "demographic_parity_diff": -0.2545454545454546,
    "equal_opportunity_diff": -0.5,
    "predictive_parity_diff": -0.2,
    "threshold_breached": true
  },
  "schema": "regaudit-fhe.report.v2",
  "schema_version": "regaudit-fhe.report.v2",
  "trust_policy_version": 1
}
